{"approach":"B-speckit-encapsulated","artifacts_consulted":["scenario/specification.md","scenario/plan.md","scenario/tasks.md","scenario/implementation/src/record-service.ts","scenario/implementation/tests/record-service.test.ts",".specify/memory/constitution.md",".experiment/translation-manifest.json",".experiment/protocol/capability-contract.md",".experiment/protocol/findings.schema.json"],"interactions":1,"human_decisions_needed":["Resolve whether record identifiers are caller-owned or service-generated.","Define an objective, measurable record-performance target."],"limitations":["Translation loss: official Spec-Kit analyze/converge does not consume scenario/decisions.md, so decision-evidence coverage was not assessed and no missing-decision finding was inferred.","The generated Spec-Kit constitution remained an unfilled template, so constitution alignment checks were skipped.","The frozen source and tests explicitly identify themselves as non-executable experiment fixtures; implementation and verification findings are based on static inspection only.","Spec-Kit converge can append remaining work to scenario/tasks.md but cannot reconcile contradictions in the specification or plan; the identifier conflict therefore still requires a human decision.","The disposable Spec-Kit feature directory, feature metadata, and default constitution are adapter state rather than original scenario artifacts."],"findings":[{"id":"SPK-001","severity":"major","category":"contradiction","artifact":"scenario/specification.md","evidence":"FR-001 at lines 10-12 requires an 8-32 character caller-provided identifier to be preserved exactly, while scenario/plan.md lines 3-4 and pre-convergence scenario/tasks.md lines 3-4 require a service-generated UUID. scenario/implementation/src/record-service.ts lines 27-30 implements UUID generation, and the input type contains no identifier to validate or preserve.","subject_reference":"FR-001/PLAN-001/T-001","requirement_reference":"FR-001","recommendation":"Decide the identifier ownership contract, then align the specification, plan, tasks, implementation, and tests. If FR-001 remains authoritative, accept, validate, and preserve the caller-provided identifier.","confidence":1,"human_decision_required":true},{"id":"SPK-002","severity":"major","category":"unverifiable_acceptance","artifact":"scenario/specification.md","evidence":"AC-003 at line 26 states only that record performance should be good; it defines no latency percentile, workload, concurrency, dataset, environment, or pass threshold.","subject_reference":"AC-003","requirement_reference":"AC-003","recommendation":"Define a measurable performance target and its controlled test conditions before adding automated performance verification.","confidence":1,"human_decision_required":true},{"id":"SPK-003","severity":"major","category":"requirement_coverage","artifact":"scenario/tasks.md","evidence":"Before the official convergence append, tasks T-001 through T-004 did not cover FR-004 or PLAN-004. Static inspection of scenario/implementation/src and scenario/implementation/tests also found no rollback runbook, backward-compatibility verification, or record-preservation recovery mechanism.","subject_reference":"FR-004/PLAN-004","requirement_reference":"FR-004","recommendation":"Complete appended task T008 by documenting rollback, verifying backward-compatible persistence, and testing that records accepted before rollback remain available.","confidence":0.99,"human_decision_required":false},{"id":"SPK-004","severity":"major","category":"requirement_coverage","artifact":"scenario/implementation/src/record-service.ts","evidence":"RecordService.create at lines 27-31 directly awaits repository.insert and returns a StoredRecord; it defines no conflict result and performs no duplicate-error mapping. The corresponding test at scenario/implementation/tests/record-service.test.ts line 5 is only a bodyless declaration.","subject_reference":"FR-002/T-002","requirement_reference":"FR-002","recommendation":"Implement duplicate-key mapping to an explicit conflict result, preserve the existing record, and add executable verification for the duplicate-creation scenario.","confidence":0.99,"human_decision_required":false},{"id":"SPK-005","severity":"major","category":"task_coverage","artifact":"scenario/implementation/src/record-service.ts","evidence":"PLAN-001 and T-001 call for POST /records and GET /records/{id}, but the scoped implementation contains only RecordService methods and no HTTP route, controller, request parsing, or response mapping.","subject_reference":"PLAN-001/T-001","requirement_reference":null,"recommendation":"After resolving SPK-001, implement the two HTTP adapters with request validation and response semantics consistent with the chosen identifier contract.","confidence":0.98,"human_decision_required":false},{"id":"SPK-006","severity":"major","category":"task_coverage","artifact":"scenario/implementation/tests/record-service.test.ts","evidence":"Lines 3-7 contain three bodyless it declarations. They do not execute creation, conflict, retrieval, payload-preservation, or identifier-contract assertions required by PLAN-005 and T-004.","subject_reference":"PLAN-005/T-004","requirement_reference":"FR-001, FR-002, FR-003","recommendation":"Replace the placeholders with executable automated tests covering caller-visible creation, duplicate conflict without mutation, retrieval with the original payload, and the resolved identifier contract.","confidence":1,"human_decision_required":false}]}