{"approach":"C-axiom-native-experimental","artifacts_consulted":["capabilities/axiom-native/SKILL.md","protocol/capability-contract.md","protocol/findings.schema.json","scenario/checksums.sha256","scenario/decisions.md","scenario/implementation/src/record-service.ts","scenario/implementation/tests/record-service.test.ts","scenario/plan.md","scenario/specification.md","scenario/tasks.md"],"interactions":1,"human_decisions_needed":["Choose whether record identifiers are caller-owned and preserved as required by FR-001, or service-generated UUIDs as asserted by the plan, tasks, implementation, and tests.","Decide whether PostgreSQL and Redis are approved architectural choices and record their rationale, alternatives, operational implications, and rollback considerations.","Define measurable performance conditions, a metric, a threshold, and observable evidence for AC-003."],"limitations":["The implementation and tests are explicitly frozen, non-executable fixtures; runtime behavior, compilation, HTTP behavior, and actual PostgreSQL or Redis integration could not be verified. They were evaluated as semantic evidence.","The supplied scenario checksums were verified successfully."],"findings":[{"id":"AXN-001","severity":"major","category":"contradiction","artifact":"scenario/plan.md","evidence":"PLAN-001 says to \"generate a UUID in the service,\" while FR-001 requires the caller to provide an 8–32 character ASCII alphanumeric identifier that is preserved exactly. T-001 repeats service-generated UUIDs, RecordService.create accepts only payload and calls ids.generate(), and the generated-identifier test intent reinforces the incompatible behavior.","subject_reference":"FR-001 / AC-001 / PLAN-001 / T-001 / RecordService.create","requirement_reference":"FR-001","recommendation":"Choose one identifier-ownership model, then align the specification, acceptance criteria, plan, tasks, service input, validation, implementation, and tests. If FR-001 remains authoritative, accept and validate the caller identifier and preserve it unchanged.","confidence":0.99,"human_decision_required":true},{"id":"AXN-002","severity":"major","category":"requirement_coverage","artifact":"scenario/implementation/src/record-service.ts","evidence":"RecordService.create directly executes `await this.repository.insert(record)` without catching or mapping a duplicate-key error to a conflict result. No conflict result or repository error abstraction is defined, although FR-002, T-002, and the test intent require duplicate-conflict mapping.","subject_reference":"RecordService.create / T-002 / duplicate-conflict test","requirement_reference":"FR-002","recommendation":"Define the duplicate-error boundary, map only the repository's duplicate-key condition to the required conflict result, preserve other failures, and verify both the conflict response and that the original payload remains retrievable.","confidence":0.98,"human_decision_required":false},{"id":"AXN-003","severity":"major","category":"requirement_coverage","artifact":"scenario/tasks.md","evidence":"The task inventory contains T-001 through T-004 and states that every listed task is represented with no additional work implied, but no task covers FR-004 or PLAN-004. Consequently, the required rollback runbook, backward-compatibility work, and evidence of record preservation across rollback have no execution or verification coverage.","subject_reference":"FR-004 / PLAN-004 / task inventory","requirement_reference":"FR-004","recommendation":"Add scoped rollback work covering the runbook, backward-compatible schema behavior, restoration of the prior release, and deterministic verification that records accepted before rollback remain available.","confidence":0.99,"human_decision_required":false},{"id":"AXN-004","severity":"major","category":"missing_decision","artifact":"scenario/decisions.md","evidence":"The decision artifact states, \"No architectural decision records exist for this fixture.\" PLAN-002 selects PostgreSQL as the system of record and PLAN-003 selects Redis caching; these are material persistence and operational choices with failure, consistency, deployment, and rollback trade-offs.","subject_reference":"PLAN-002 / PLAN-003","requirement_reference":null,"recommendation":"Record explicit decisions approving or replacing PostgreSQL and Redis, including rationale, alternatives, ownership boundaries, consistency and failure semantics, operational impact, and rollback consequences.","confidence":0.96,"human_decision_required":true},{"id":"AXN-005","severity":"major","category":"unverifiable_acceptance","artifact":"scenario/specification.md","evidence":"AC-003 only states, \"Record performance should be good.\" It supplies no operation or workload conditions, metric, threshold, measurement method, or observable pass/fail evidence.","subject_reference":"AC-003","requirement_reference":"AC-003","recommendation":"Replace AC-003 with measurable acceptance criteria specifying the relevant operation, workload and environment conditions, latency or throughput metric, threshold or percentile, and repeatable evidence collection method.","confidence":1,"human_decision_required":true}]}