{"approach":"C-current-axiom-baseline","artifacts_consulted":[".agents/skills/axiom-review/SKILL.md","protocol/capability-contract.md","protocol/findings.schema.json","scenario/checksums.sha256","scenario/decisions.md","scenario/implementation/src/record-service.ts","scenario/implementation/tests/record-service.test.ts","scenario/plan.md","scenario/specification.md","scenario/tasks.md"],"interactions":1,"human_decisions_needed":["Choose the authoritative identifier model: caller-provided identifiers required by FR-001 or service-generated UUIDs described by the plan, tasks, implementation, and tests.","Define an objective performance target and measurement conditions for AC-003.","Approve or replace the PostgreSQL and Redis architecture and document its operational and rollback trade-offs."],"limitations":["The implementation and tests explicitly identify themselves as non-executable fixtures, and no executable project manifest or concrete infrastructure adapters are provided; runtime, HTTP, PostgreSQL, Redis, and test behavior therefore could not be verified.","Analysis was limited to the current Axiom harness, every file under scenario/, and the neutral capability contract and output schema. Scenario checksums were verified successfully."],"findings":[{"id":"AXC-001","severity":"major","category":"contradiction","artifact":"scenario/specification.md","evidence":"FR-001 requires the caller to provide an 8–32 character ASCII alphanumeric identifier and requires exact preservation. PLAN-001 and T-001 instead require a service-generated UUID, while RecordInput has no identifier and RecordService.create assigns ids.generate(). AC-001 consequently cannot be satisfied by the implemented interface.","subject_reference":"FR-001","requirement_reference":"FR-001","recommendation":"Resolve identifier ownership explicitly. If FR-001 remains authoritative, accept and validate the caller identifier, preserve it, and align the plan, tasks, implementation, and tests. If generated UUIDs are intended, formally revise FR-001 and AC-001 before aligning downstream artifacts.","confidence":1,"human_decision_required":true},{"id":"AXC-002","severity":"major","category":"task_coverage","artifact":"scenario/implementation/src/record-service.ts","evidence":"T-001 requires implementing POST /records and PLAN-001 also requires GET /records/{id}, but the implementation contains only RecordService methods. No HTTP route, handler, request mapping, response mapping, or status behavior is present.","subject_reference":"T-001","requirement_reference":null,"recommendation":"Add the planned HTTP boundary and black-box verification, or narrow the task and plan if HTTP behavior is intentionally outside this fixture.","confidence":0.99,"human_decision_required":false},{"id":"AXC-003","severity":"major","category":"task_coverage","artifact":"scenario/implementation/src/record-service.ts","evidence":"T-002 requires a PostgreSQL repository and unique-key conflict mapping. The artifact only declares PostgresRecordRepository; RecordService.create propagates repository errors without mapping them to a conflict result, and no concrete repository is supplied. FR-002 and AC-002 therefore lack implementation coverage.","subject_reference":"T-002","requirement_reference":"FR-002","recommendation":"Implement the repository boundary and explicit duplicate-to-conflict translation, preserve the existing record on duplicates, and verify the behavior through unit and integration tests.","confidence":1,"human_decision_required":false},{"id":"AXC-004","severity":"major","category":"task_coverage","artifact":"scenario/implementation/src/record-service.ts","evidence":"T-003 and PLAN-003 call for Redis caching. RecordService contains cache fill and read-through orchestration, but RedisRecordCache is only an interface; no Redis adapter or controlled integration verification establishes that Redis caching was implemented.","subject_reference":"T-003","requirement_reference":null,"recommendation":"Provide a concrete Redis adapter and controlled integration tests, or revise the task wording to state that only cache orchestration and its abstraction are in scope.","confidence":0.96,"human_decision_required":false},{"id":"AXC-005","severity":"major","category":"task_coverage","artifact":"scenario/implementation/tests/record-service.test.ts","evidence":"T-004 and PLAN-005 require automated tests for generated identifiers, duplicate conflicts, and retrieval, but the file contains only three bodyless it declarations. It performs no setup, invocation, assertion, conflict-state check, or cache/database-path check.","subject_reference":"T-004","requirement_reference":"FR-002; FR-003","recommendation":"Replace the declarations with executable assertions covering the resolved identifier contract, duplicate conflict without mutation, retrieval with the original payload, cache hits, database fallback, and cache fill.","confidence":1,"human_decision_required":false},{"id":"AXC-006","severity":"major","category":"requirement_coverage","artifact":"scenario/tasks.md","evidence":"FR-004 requires rollback without losing accepted records, and PLAN-004 calls for a rollback runbook and backward-compatible schema changes. No task covers FR-004 or PLAN-004, and the scenario contains no runbook, schema change, rollback implementation, or rollback verification.","subject_reference":"FR-004","requirement_reference":"FR-004","recommendation":"Add scoped rollback tasks, document the runbook and compatibility mechanism, and define a deterministic rollback test demonstrating preservation of records accepted before rollback.","confidence":1,"human_decision_required":false},{"id":"AXC-007","severity":"major","category":"missing_decision","artifact":"scenario/decisions.md","evidence":"The artifact states that no architectural decision records exist, while PLAN-002 and PLAN-003 introduce PostgreSQL persistence and Redis caching. Their consistency, failure handling, operational burden, and rollback implications are not supported by decision evidence.","subject_reference":"PLAN-002; PLAN-003","requirement_reference":null,"recommendation":"Record an architecture decision that accepts or replaces PostgreSQL and Redis, including rationale, alternatives, consistency and failure semantics, operational consequences, and rollback implications.","confidence":0.96,"human_decision_required":true},{"id":"AXC-008","severity":"major","category":"unverifiable_acceptance","artifact":"scenario/specification.md","evidence":"AC-003 says only that record performance should be good. It defines no measurable metric, threshold, workload, environment, percentile, or observation period, so acceptance cannot be determined objectively.","subject_reference":"AC-003","requirement_reference":"AC-003","recommendation":"Replace AC-003 with measurable targets and test conditions, such as latency percentiles and throughput under a defined workload and environment.","confidence":1,"human_decision_required":true}]}