{
  "approach": "oracle",
  "artifacts_consulted": [
    "scenario/specification.md",
    "scenario/plan.md",
    "scenario/tasks.md",
    "scenario/implementation/src/record-service.ts",
    "scenario/implementation/tests/record-service.test.ts",
    "scenario/decisions.md"
  ],
  "interactions": 1,
  "human_decisions_needed": [
    "Decide whether PostgreSQL is accepted through an ADR or removed from the plan.",
    "Define an objective performance threshold or remove AC-003."
  ],
  "limitations": [
    "Ground truth covers only the five deliberately seeded faults."
  ],
  "findings": [
    {
      "id": "EXP-001",
      "severity": "major",
      "category": "requirement_coverage",
      "artifact": "scenario/tasks.md",
      "evidence": "FR-004 and PLAN-004 require rollback, but no task, implementation, or test covers rollback.",
      "subject_reference": "FR-004",
      "requirement_reference": "FR-004",
      "recommendation": "Add rollback implementation and verification tasks or revise the requirement before execution.",
      "confidence": 1,
      "human_decision_required": false
    },
    {
      "id": "EXP-002",
      "severity": "major",
      "category": "unsupported_behavior",
      "artifact": "scenario/tasks.md",
      "evidence": "T-003 and the implementation add Redis caching although no functional requirement establishes caching or a latency need.",
      "subject_reference": "T-003",
      "requirement_reference": null,
      "recommendation": "Remove Redis scope or add and approve a requirement that justifies it.",
      "confidence": 1,
      "human_decision_required": true
    },
    {
      "id": "EXP-003",
      "severity": "major",
      "category": "contradiction",
      "artifact": "scenario/plan.md",
      "evidence": "FR-001 requires a caller-supplied identifier, while PLAN-001, T-001, RecordInput, and RecordService create generate an identifier.",
      "subject_reference": "FR-001",
      "requirement_reference": "FR-001",
      "recommendation": "Make plan, tasks, and implementation accept and preserve the caller identifier.",
      "confidence": 1,
      "human_decision_required": false
    },
    {
      "id": "EXP-004",
      "severity": "major",
      "category": "unverifiable_acceptance",
      "artifact": "scenario/specification.md",
      "evidence": "AC-003 says performance should be good without a metric, workload, threshold, or measurement method.",
      "subject_reference": "AC-003",
      "requirement_reference": null,
      "recommendation": "Define a measurable performance threshold and test conditions.",
      "confidence": 1,
      "human_decision_required": true
    },
    {
      "id": "EXP-005",
      "severity": "major",
      "category": "missing_decision",
      "artifact": "scenario/decisions.md",
      "evidence": "PLAN-002 introduces PostgreSQL, but the decision artifact states that no architectural decisions exist.",
      "subject_reference": "PLAN-002",
      "requirement_reference": null,
      "recommendation": "Record and review the persistence decision or keep the plan technology-neutral.",
      "confidence": 1,
      "human_decision_required": true
    }
  ]
}
